{
  "evidence_id": "pending-phase5b",
  "normalized_artifact_sha256": null,
  "raw_output": {
    "access_restriction_verified": false,
    "handling_status": "not-created",
    "quarantine_location_record": null,
    "sha256": null,
    "tracked": false
  },
  "redactions": [],
  "run_id": "pending-phase5b",
  "schema_version": "1.0",
  "stable_evidence": {},
  "volatile_metadata": {}
}
